{
  "schema_version": 1,
  "archetype": "global:custom@1",
  "coterie_version": "^0.1.0",
  "providers": {
    "codex": {
      "builder": {
        "mode": "job",
        "permission_profile": {
          "filesystem": "read-only",
          "network": "deny",
          "approvals": "never"
        }
      },
      "coordinator": {
        "mode": "interactive",
        "permission_profile": {
          "filesystem": "read-only",
          "network": "deny",
          "approvals": "never"
        }
      }
    }
  },
  "fingerprint": "f9930de67b591135e7427cdffadb73de58fd1c62a7c244457476a587df356a00"
}
